product description,Hscode
"This sleek green watch includes a 1.2-inch screen and advanced health monitoring, perfect for staying fit and connected",910211
"The stylish gray watch boasts a 1.5-inch display and heart rate monitoring, ideal for those who value both style and performance",910211
"Featuring a classic black design and a 1.4-inch AMOLED display, this watch offers fitness tracking and notifications for everyday use",910211
"The modern white watch includes a 1.3-inch screen and advanced GPS functionality, perfect for tech-savvy and active users",910211
"This stylish silver watch features a 1.5-inch AMOLED display and heart rate tracking, ideal for fitness enthusiasts and busy professionals",910211
"With a sleek navy blue band and a 1.4-inch screen, this watch includes customizable watch faces and sleep monitoring features",910211
"The elegant rose gold watch boasts a 1.2-inch AMOLED display and water resistance, perfect for both fashion and function",910211
"This modern gray watch includes a 1.5-inch display and advanced fitness tracking, designed for active and tech-savvy users",910211
"Featuring a stylish black band and a 1.3-inch screen, this smartwatch offers heart rate monitoring and notifications for a balanced lifestyle",910211
"The elegant white watch features a 1.4-inch AMOLED display and customizable settings, ideal for both casual and formal wear",910211
"This sleek blue watch includes a 1.2-inch screen and advanced health tracking, perfect for daily use and fitness monitoring",910211
"With a stylish green band and a 1.5-inch display, this watch offers heart rate monitoring and water resistance for an active lifestyle",910211
"The modern silver watch features a 1.3-inch AMOLED display and built-in GPS, designed for those who need both style and functionality",910211
"This elegant gray watch includes a 1.4-inch screen and advanced fitness tracking, ideal for maintaining a healthy and active lifestyle",910211
"Featuring a sleek black design and a 1.2-inch AMOLED display, this smartwatch offers notifications and customizable watch faces",910211
"The stylish blue watch boasts a 1.5-inch display and heart rate monitoring, perfect for fitness enthusiasts and tech-savvy users",910211
"This modern rose gold watch includes a 1.3-inch AMOLED display and water resistance, designed for both casual and active wear",910211
"With a classic gray design and a 1.4-inch screen, this watch offers GPS tracking and fitness monitoring for a balanced lifestyle",910211
"The elegant black watch features a 1.2-inch AMOLED display and advanced health tracking, perfect for tech enthusiasts and athletes",910211
"This stylish white watch includes a 1.5-inch display and built-in heart rate monitor, ideal for maintaining a healthy lifestyle",910211
"Featuring a modern green band and a 1.3-inch screen, this watch offers fitness tracking and water resistance for an active lifestyle",910211
"The elegant blue watch boasts a 1.4-inch AMOLED display and advanced health monitoring, perfect for both casual and fitness use",910211
"This sleek gray watch features a 1.2-inch screen and customizable settings, ideal for staying connected and tracking daily activities",910211
"With a stylish black design and a 1.5-inch AMOLED display, this watch includes heart rate monitoring and notifications for a balanced lifestyle",910211
"The modern rose gold watch features a 1.3-inch display and built-in GPS, designed for those who enjoy both fashion and performance",910211
"This sleek black smartwatch comes with a 1.4-inch AMOLED display and integrated fitness tracker, perfect for staying fit and connected",910211
"With its stylish silver finish and a 1.3-inch screen, this smartwatch offers heart rate monitoring and notifications for a balanced lifestyle",910211
"The elegant gold watch features a 1.2-inch display and advanced sleep tracking, designed for those who value both style and functionality",910211
"This rugged gray sports watch boasts a 1.5-inch display and GPS functionality, ideal for tracking your outdoor adventures",910211
"Featuring a vibrant blue band and a 1.4-inch AMOLED screen, this smartwatch includes a built-in step counter and notification alerts",910211
"The classic rose gold watch offers a 1.3-inch touchscreen and advanced health monitoring features, perfect for both casual and formal wear",910211
"This modern black watch includes a 1.5-inch display and a heart rate monitor, ideal for tracking workouts and daily activities",910211
"With a sleek silver metal band and a 1.2-inch screen, this watch features step counting and sleep analysis, designed for everyday use",910211
"The elegant white watch offers a 1.4-inch AMOLED display and GPS tracking, making it perfect for fitness and navigation",910211
"This stylish green watch features a 1.3-inch screen and water resistance, ideal for both active lifestyles and everyday wear",910211
"The sleek navy blue watch includes a 1.2-inch AMOLED display and advanced health tracking, perfect for tech-savvy users",910211
"With its durable black band and 1.4-inch screen, this smartwatch includes an activity tracker and customizable watch faces",910211
"The classic silver watch features a 1.5-inch display and built-in heart rate monitor, perfect for style and functionality",910211
This elegant leather band watch includes a 1.3-inch touchscreen and offers notifications and fitness tracking for daily wear,910211
"The modern rose gold watch features a 1.4-inch display and sleep monitoring, ideal for keeping track of your health and rest",910211
"This sporty gray watch offers a 1.5-inch screen and water resistance, designed for athletes and outdoor enthusiasts",910211
"Featuring a vibrant red band and a 1.2-inch display, this smartwatch includes GPS tracking and fitness monitoring features",910211
"The stylish black watch offers a 1.3-inch AMOLED display and customizable settings, perfect for personalizing your experience",910211
"With a classic silver design and a 1.4-inch touchscreen, this watch provides seamless connectivity and fitness tracking",910211
"The elegant white watch includes a 1.3-inch display and advanced health tracking, ideal for both casual and active users",910211
"The modern blue watch offers a 1.5-inch screen and heart rate monitoring, designed for style and performance.""",910211
"""Featuring a sleek black band and a 1.4-inch AMOLED display, this smartwatch includes notifications and activity tracking.""",910211
"""This rugged gray watch boasts a 1.2-inch display and GPS functionality, perfect for hiking and outdoor activities.""",910211
"""With its stylish rose gold design and a 1.3-inch screen, this watch includes fitness tracking and customizable watch faces.""",910211
"""The elegant silver watch features a 1.5-inch display and heart rate monitoring, ideal for maintaining a healthy lifestyle.",910211
"""The elegant silver watch features a 1.5-inch display and heart rate monitoring, ideal for maintaining a healthy lifestyle.",910211
"""Featuring a sleek black band and a 1.3-inch touchscreen, this smartwatch offers sleep tracking and smartphone notifications.",910211
"""The classic white watch boasts a 1.5-inch display and advanced health features, perfect for daily use and fitness tracking.",910211
"With a sleek navy blue design and a 1.4-inch display, this watch includes water resistance and activity monitoring.""",910211
"""This elegant rose gold watch offers a 1.2-inch screen and customizable watch faces, ideal for fashion and functionality.""",910211
"""The stylish gray watch includes a 1.3-inch AMOLED display and heart rate monitoring, perfect for fitness enthusiasts.""",910211
"""Featuring a vibrant black band and a 1.4-inch screen, this smartwatch includes GPS tracking and activity monitoring features.",910211
"""This rugged white watch offers a 1.5-inch display and advanced fitness tracking, designed for durability and high performance",910211
"With a classic silver design and a 1.3-inch touchscreen, this watch includes notifications and sleep tracking capabilities.""",910211
"The modern blue watch features a 1.4-inch AMOLED display and heart rate monitoring, ideal for active and tech-savvy users.""",910211
"This stylish green watch includes a 1.2-inch display and water resistance, designed for both casual and outdoor use.",910211
"""The elegant rose gold watch boasts a 1.3-inch screen and advanced health monitoring features, perfect for everyday wear.""",910211
"Featuring a sleek black band and a 1.5-inch AMOLED display, this watch includes customizable settings and fitness tracking",910211
"The modern gray watch offers a 1.4-inch display and built-in GPS, designed for both performance and style",910211
"With a stylish navy blue band and a 1.3-inch screen, this smartwatch includes sleep monitoring and activity tracking features.""",910211
"The elegant white watch features a 1.5-inch display and heart rate monitoring, perfect for health-conscious users and daily activities",910211
"""This sleek silver watch includes a 1.4-inch AMOLED screen and advanced fitness tracking, ideal for both casual and athletic use",910211
"""Featuring a modern black design and a 1.2-inch display, this watch offers GPS tracking and notifications for a balanced lifestyle.""",910211
"""The stylish blue watch boasts a 1.5-inch screen and built-in heart rate monitor, perfect for high-performance activities.""",910211
"""This elegant gray watch includes a 1.3-inch AMOLED display and water resistance, designed for everyday wear and active use.""",910211
"With a sleek rose gold band and a 1.4-inch display, this smartwatch includes fitness tracking and sleep monitoring features.""",910211
"""The modern black watch features a 1.2-inch screen and advanced health monitoring, perfect for both style and function.""",910211
"""This stylish white mobile offers a 1.5-inch AMOLED display and heart rate tracking, ideal for staying connected and healthy.""",910211
"""Featuring a vibrant green band and a 1.3-inch display, this watch includes GPS tracking and customizable watch faces.""",910211
"""The elegant blue watch boasts a 1.4-inch screen and advanced fitness tracking, perfect for those who prioritize health and technology.""",910211
"""This sleek gray watch includes a 1.2-inch screen and water resistance, ideal for both casual and active lifestyles.""",910211
"""With a stylish black design and a 1.5-inch display, this smartwatch offers heart rate monitoring and notifications for daily use.""",910211
"The modern silver watch features a 1.4-inch AMOLED display and advanced health features, perfect for daily wear and fitness tracking.""",910211
"The modern silver watch features a 1.4-inch AMOLED display and advanced health features, perfect for daily wear and fitness tracking.""",910211
"""Featuring a sleek navy blue band and a 1.2-inch screen, this watch offers sleep tracking and customizable watch faces.""",910211
"The stylish gray watch boasts a 1.5-inch AMOLED display and heart rate monitoring, perfect for both fitness and everyday use.""",910211
"""This rugged black watch includes a 1.4-inch display and advanced GPS functionality, ideal for outdoor adventures and sports.""",910211
"""With a classic white design and a 1.3-inch screen, this smartwatch offers fitness tracking and notifications for daily wear.""",910211
"The modern green watch features a 1.5-inch AMOLED display and water resistance, perfect for active lifestyles and outdoor activities.""",910211
"""This stylish blue watch includes a 1.2-inch screen and advanced health tracking, designed for both fashion and performance.""",910211
"""Featuring a sleek rose gold band and a 1.4-inch display, this watch offers customizable settings and fitness tracking capabilities.""",910211
"""The elegant gray watch boasts a 1.3-inch AMOLED display and built-in heart rate monitor, perfect for maintaining a healthy lifestyle.""",910211
"""This stylish black watch includes a 1.5-inch screen and advanced GPS functionality, ideal for tech enthusiasts and athletes.""",910211
"With a modern silver design and a 1.4-inch display, this smartwatch offers fitness tracking and notifications for a balanced lifestyle.",910211
"The elegant blue watch features a 1.3-inch AMOLED display and water resistance, designed for both casual and fitness use.""",910211
"""This sleek green watch includes a 1.2-inch screen and advanced health monitoring, perfect for staying fit and connected.""",910211
"The stylish gray watch boasts a 1.5-inch display and heart rate monitoring, ideal for those who value both style and performance.""",910211
"Featuring a classic black design and a 1.4-inch AMOLED display, this smartwatch includes sleep tracking and activity monitoring.""",910211
"This modern white watch includes a 1.3-inch screen and built-in GPS, designed for those who need both fashion and functionality.""",910211
"The elegant silver watch features a 1.5-inch AMOLED display and heart rate monitoring, perfect for staying active and connected.""",910211
"""With a sleek rose gold band and a 1.2-inch display, this watch offers customizable settings and advanced health tracking features.""",910211
"This stylish navy blue watch includes a 1.4-inch screen and water resistance, ideal for both everyday wear and outdoor activities.",910211
"The modern black watch features a 1.3-inch AMOLED display and GPS tracking, designed for tech-savvy and active users.""",910211
"This elegant green watch includes a 1.5-inch display and advanced fitness tracking, perfect for maintaining a healthy lifestyle.",910211
"Featuring a sleek gray band and a 1.2-inch screen, this smartwatch offers notifications and customizable watch faces.",910211
"The stylish blue watch boasts a 1.4-inch AMOLED display and heart rate monitoring, ideal for both casual and active wear.",910211
"This modern white watch includes a 1.3-inch display and water resistance, designed for fitness tracking and daily use",910211
"With a classic rose gold design and a 1.5-inch screen, this watch features advanced health monitoring and customizable settings",910211
"The elegant black watch offers a 1.4-inch AMOLED display and built-in GPS, perfect for those who need both fashion and functionality",910211
"""This stylish gray watch features a 1.3-inch screen and heart rate monitoring, ideal for maintaining a balanced lifestyle",910211
"""The modern blue watch includes a 1.5-inch AMOLED display and advanced fitness tracking, perfect for both casual and athletic use.",910211
"""Featuring a sleek silver band and a 1.2-inch display, this watch offers GPS tracking and customizable watch faces.""",910211
"""The elegant white watch boasts a 1.4-inch screen and heart rate monitoring, ideal for keeping track of health and daily activities.""",910211
"""This stylish black watch includes a 1.3-inch AMOLED display and built-in GPS, designed for tech enthusiasts and active users.""",910211
"""With a classic green design and a 1.5-inch screen, this watch offers advanced health tracking and water resistance.""",910211
"""The modern rose gold watch features a 1.2-inch display and sleep monitoring, perfect for both style and functionality.""",910211
"""This sleek blue watch includes a 1.4-inch AMOLED screen and heart rate monitoring, ideal for fitness enthusiasts and daily wear.""",910211
"""The elegant gray watch boasts a 1.3-inch screen and advanced health features, perfect for maintaining a healthy lifestyle.""",910211
"""Featuring a stylish white band and a 1.5-inch display, this smartwatch offers customizable settings and fitness tracking capabilities.""",910211
"""The modern black watch includes a 1.2-inch AMOLED display and GPS functionality, ideal for tech-savvy and active users.""",910211
"""This sleek stainless steel watch features a 1.5-inch AMOLED display and built-in fitness tracker, ideal for both casual and professional settings.""",910211
"""With a vibrant red band and a 1.4-inch screen, this smartwatch includes advanced health monitoring and customizable watch faces.""",910211
"""The modern gray watch includes a 1.3-inch AMOLED display and sleep tracking, perfect for tech enthusiasts and daily use.""",910211
"""Featuring a classic blue design and a 1.2-inch screen, this watch offers heart rate monitoring and GPS functionality for active users.""",910211
"""This elegant white watch boasts a 1.5-inch display and water resistance, designed for both style and practicality in any weather.""",910211
"""With its stylish rose gold band and a 1.4-inch AMOLED screen, this smartwatch includes fitness tracking and notifications for a balanced lifestyle.""",910211
"""The rugged black watch offers a 1.3-inch display and advanced GPS, ideal for outdoor adventures and tracking your fitness goals.",910211
"This sleek silver watch features a 1.2-inch AMOLED screen and heart rate monitoring, perfect for maintaining a healthy lifestyle.""",910211
"""The stylish navy blue watch includes a 1.5-inch display and advanced health tracking, designed for both casual and athletic wear.",910211
"""Featuring a classic green band and a 1.3-inch AMOLED display, this watch offers GPS tracking and customizable settings for active users.""",910211
"This modern gray watch includes a 1.4-inch screen and built-in heart rate monitor, ideal for staying fit and connected throughout the day.""",910211
"With a stylish black design and a 1.2-inch AMOLED display, this smartwatch features fitness tracking and notifications for a dynamic lifestyle.",910211
"The elegant rose gold watch features a 1.5-inch screen and sleep monitoring, perfect for both fashion and functionality.""",910211
"""This rugged blue watch offers a 1.3-inch AMOLED display and advanced health features, designed for durability and high performance.""",910211
"""Featuring a classic white band and a 1.4-inch display, this smartwatch includes customizable watch faces and fitness tracking capabilities.""",910211
"The modern black watch includes a 1.2-inch AMOLED screen and advanced GPS, ideal for tech-savvy and active users.""",910211
"""With a stylish green design and a 1.5-inch screen, this watch offers heart rate monitoring and water resistance for an active lifestyle.""",910211
"This sleek silver watch features a 1.3-inch AMOLED display and fitness tracking, perfect for those who value both style and performance.""",910211
"The elegant blue watch includes a 1.4-inch screen and advanced health monitoring, designed for everyday use and fitness tracking.""",910211
"""Featuring a modern gray band and a 1.5-inch display, this smartwatch offers GPS functionality and customizable settings for active lifestyles.""",910211
"This sophisticated black watch features a 1.5-inch AMOLED display and advanced fitness tracking, perfect for everyday wear and workouts.""",910211
"With a classic silver design and a 1.3-inch screen, this smartwatch includes heart rate monitoring and notifications for a balanced lifestyle.""",910211
"The modern rose gold watch boasts a 1.4-inch AMOLED display and built-in GPS, ideal for both fashion and functionality.""",910211
"""Featuring a vibrant blue band and a 1.2-inch display, this watch offers sleep tracking and customizable settings for daily use.""",910211
"This elegant white watch includes a 1.5-inch AMOLED screen and advanced health features, perfect for fitness enthusiasts and casual wear.""",910211
"With a sleek gray band and a 1.3-inch screen, this smartwatch includes GPS tracking and notifications for active users.""",910211
"The stylish green watch offers a 1.4-inch AMOLED display and heart rate monitoring, designed for both fashion and performance.",910211
"""This rugged black watch includes a 1.2-inch display and built-in GPS, perfect for outdoor adventures and tracking fitness goals.""",910211
"Featuring a sleek silver design and a 1.5-inch AMOLED screen, this smartwatch includes customizable watch faces and advanced health tracking.""",910211
"The modern navy blue watch boasts a 1.3-inch display and water resistance, ideal for both everyday wear and outdoor activities.""",910211
"""This elegant rose gold watch features a 1.4-inch AMOLED display and advanced sleep tracking, perfect for stylish and tech-savvy users.""",910211
"""With a vibrant green band and a 1.2-inch screen, this watch includes fitness tracking and customizable settings for active lifestyles.""",910211
"The stylish black watch offers a 1.5-inch display and heart rate monitoring, designed for both casual and athletic use.""",910211
"""Featuring a classic white design and a 1.3-inch AMOLED display, this smartwatch includes advanced health tracking and notifications",910211
"""This modern gray watch includes a 1.4-inch screen and built-in GPS, perfect for those who value both performance and style.""",910211
"With a sleek blue band and a 1.2-inch display, this watch offers customizable watch faces and fitness tracking capabilities.""",910211
"The elegant silver watch boasts a 1.5-inch AMOLED display and advanced health monitoring, ideal for everyday wear and fitness tracking.""",910211
"""This stylish rose gold watch features a 1.3-inch screen and water resistance, perfect for maintaining a healthy lifestyle and staying connected.""",910211
"Featuring a modern black design and a 1.4-inch AMOLED display, this smartwatch includes heart rate monitoring and sleep tracking.""",910211
"""The classic green watch includes a 1.2-inch display and built-in GPS, designed for both tech enthusiasts and outdoor adventurers.""",910211
"""This sophisticated blue watch features a 1.5-inch AMOLED screen and customizable settings, ideal for fitness tracking and daily activities.""",910211
"The elegant white watch boasts a 1.4-inch AMOLED screen and heart rate monitoring, perfect for casual and formal wear.""",910211
"With a stylish gray band and a 1.3-inch display, this watch offers advanced health features and notifications for a balanced lifestyle.""",910211
"This modern rose gold watch includes a 1.2-inch display and advanced sleep tracking, designed for those who appreciate both style and functionality.""",910211
"Featuring a sleek black design and a 1.5-inch AMOLED screen, this smartwatch includes fitness tracking and customizable watch faces.""",910211
"The stylish green watch offers a 1.3-inch display and water resistance, ideal for both everyday use and active lifestyles.""",910211
"This elegant navy blue watch features a 1.4-inch AMOLED display and advanced health monitoring, perfect for staying fit and connected.""",910211
"""With a classic silver band and a 1.2-inch screen, this watch includes GPS tracking and customizable settings for both style and performance.""",910211
"""The modern black watch boasts a 1.5-inch AMOLED display and heart rate monitoring, designed for those who value both functionality and fashion.""",910211
"This stylish white watch features a 1.3-inch display and built-in GPS, perfect for tech-savvy users and fitness enthusiasts.""",910211
"""Featuring a vibrant rose gold band and a 1.4-inch AMOLED screen, this smartwatch includes advanced health tracking and notifications.""",910211
"""The classic gray watch includes a 1.2-inch display and water resistance, ideal for both casual and active wear.""",910211
"This elegant blue watch features a 1.5-inch AMOLED display and customizable settings, perfect for maintaining a healthy lifestyle and staying connected.""",910211
"With a sleek silver design and a 1.3-inch screen, this watch includes advanced fitness tracking and sleep monitoring for daily use.""",910211
"""The modern black watch offers a 1.4-inch AMOLED display and heart rate monitoring, designed for both fashion and functionality.""",910211
"This stylish green watch includes a 1.2-inch display and GPS tracking, ideal for both casual wear and outdoor activities.""",910211
"""Featuring a classic navy blue band and a 1.5-inch AMOLED screen, this smartwatch includes advanced health monitoring and notifications.""",910211
"The elegant white watch boasts a 1.3-inch display and built-in GPS, perfect for tech-savvy and active users.""",910211
"""This sleek rose gold watch features a 1.4-inch AMOLED display and water resistance, designed for both stylish and practical use.",910211
"""With a modern gray band and a 1.2-inch screen, this watch includes advanced health tracking and customizable watch faces.""",910211
"The stylish blue watch offers a 1.5-inch AMOLED display and heart rate monitoring, ideal for both fitness and daily activities.""",910211
"""This elegant silver watch features a 1.3-inch AMOLED display and GPS functionality, perfect for tech enthusiasts and stylish wearers.""",910211
"""Featuring a classic black design and a 1.4-inch screen, this smartwatch includes fitness tracking and advanced health features.""",910211
"""The modern green watch includes a 1.5-inch AMOLED display and heart rate monitoring, designed for active users and fitness enthusiasts.""",910211
"With a stylish navy blue band and a 1.2-inch screen, this watch offers customizable settings and advanced health tracking.""",910211
"""The elegant white watch boasts a 1.4-inch AMOLED display and built-in GPS, perfect for those who appreciate both fashion and performance.""",910211
"This sleek gray watch features a 1.3-inch display and water resistance, ideal for both everyday wear and outdoor activities.",910211
"""Featuring a stylish rose gold design and a 1.5-inch AMOLED screen, this smartwatch includes heart rate monitoring and notifications.""",910211
"""The modern blue watch includes a 1.2-inch display and advanced health tracking, perfect for staying fit and connected.""",910211
"""This elegant black watch features a 1.4-inch AMOLED display and customizable settings, designed for both casual and tech-savvy users.""",910211
"""With a classic silver band and a 1.3-inch screen, this watch offers fitness tracking and GPS functionality for daily wear.""",910211
