product description,Hscode
"The stylish green watch includes a 1.5-inch AMOLED display and heart rate monitoring, ideal for those who value both fashion and performance.""",910211
"Featuring a sleek navy blue design and a 1.2-inch screen, this smartwatch includes advanced health monitoring and notifications.""",910211
"This modern gray watch boasts a 1.4-inch AMOLED display and built-in GPS, perfect for active users and outdoor enthusiasts.""",910211
"""With a classic white band and a 1.3-inch display, this watch offers customizable watch faces and fitness tracking capabilities.""",910211
"The elegant rose gold watch includes a 1.5-inch AMOLED screen and heart rate monitoring, designed for both style and function.""",910211
"""This stylish black watch features a 1.2-inch display and advanced health tracking, perfect for maintaining a healthy lifestyle.""",910211
"""Featuring a sleek green band and a 1.4-inch AMOLED display, this smartwatch includes GPS tracking and customizable settings.""",910211
"The modern blue watch boasts a 1.3-inch screen and water resistance, ideal for both casual wear and outdoor activities.""",910211
"With a classic gray design and a 1.5-inch AMOLED display, this watch includes heart rate monitoring and advanced health features.""",910211
"""The elegant silver watch features a 1.2-inch display and GPS functionality, perfect for both style and performance.""",910211
"""This stylish rose gold watch includes a 1.4-inch AMOLED screen and water resistance, designed for active and tech-savvy users.""",910211
"""Featuring a sleek navy blue band and a 1.3-inch display, this smartwatch offers fitness tracking and customizable watch faces.""",910211
"""The modern white watch boasts a 1.5-inch AMOLED display and heart rate monitoring, perfect for both fashion and function.""",910211
"""This elegant green watch includes a 1.2-inch screen and advanced health tracking, designed for staying fit and connected.""",910211
"With a stylish black design and a 1.4-inch AMOLED display, this watch offers GPS tracking and customizable settings.""",910211
"The classic gray watch features a 1.3-inch screen and advanced fitness tracking, ideal for both casual wear and active lifestyles",910211
"""This modern blue watch includes a 1.5-inch AMOLED display and built-in GPS, perfect for tech enthusiasts and outdoor adventurers.""",910211
"""Featuring a sleek rose gold band and a 1.2-inch screen, this smartwatch includes advanced health monitoring and notifications.",910211
"""The elegant white watch boasts a 1.4-inch AMOLED display and heart rate monitoring, ideal for those who appreciate both style and functionality.""",910211
"""This stylish green watch includes a 1.3-inch display and customizable watch faces, perfect for both everyday wear and active use.",910211
"With a classic navy blue band and a 1.5-inch AMOLED screen, this smartwatch offers advanced health tracking and GPS functionality.""",910211
"""The modern silver watch features a 1.2-inch display and water resistance, designed for both style and durability.""",910211
"This elegant black watch includes a 1.4-inch AMOLED screen and advanced fitness tracking, perfect for maintaining a healthy lifestyle.""",910211
"""Featuring a sleek gray design and a 1.3-inch screen, this watch offers heart rate monitoring and customizable settings for tech-savvy users.""",910211
"The stylish rose gold watch boasts a 1.5-inch AMOLED display and built-in GPS, ideal for both fashion and functionality.""",910211
"This modern green watch includes a 1.2-inch display and advanced health features, perfect for staying connected and active.",910211
"""With a classic blue band and a 1.4-inch AMOLED screen, this smartwatch includes fitness tracking and customizable watch faces.""",910211
"""The elegant white watch features a 1.3-inch display and water resistance, designed for both everyday use and outdoor adventures.""",910211
"""This stylish black watch includes a 1.5-inch AMOLED screen and heart rate monitoring, perfect for maintaining a healthy and active lifestyle.""",910211
"""Featuring a sleek rose gold design and a 1.2-inch display, this smartwatch offers advanced health tracking and notifications.""",910211
"The modern blue watch boasts a 1.4-inch AMOLED display and customizable settings, designed for both tech enthusiasts and everyday wear.""",910211
"This elegant silver watch includes a 1.3-inch screen and built-in GPS, perfect for both style and functionality.""",910211
"With a classic green band and a 1.5-inch AMOLED display, this smartwatch offers advanced health monitoring and customizable settings.",910211
"""The stylish white watch features a 1.2-inch display and water resistance, ideal for both casual and active use.""",910211
"This modern gray watch includes a 1.4-inch AMOLED screen and fitness tracking, perfect for staying fit and connected.""",910211
"Featuring a classic black design and a 1.3-inch display, this watch offers GPS tracking and advanced health features.""",910211
"The elegant rose gold watch includes a 1.5-inch AMOLED screen and heart rate monitoring, designed for those who appreciate both style and function",910211
"""This stylish green watch features a 1.2-inch display and advanced health tracking, perfect for staying active and connected.""",910211
"With a sleek navy blue band and a 1.4-inch AMOLED screen, this smartwatch includes customizable settings and fitness tracking capabilities.""",910211
"This sleek red mountain bike features a sturdy aluminum frame and 21-speed gear system, perfect for off-road adventures.""",871190
"With a lightweight carbon frame and 18-speed gear system, this black road bike is designed for speed and efficiency.""",871190
"""The versatile blue hybrid bike includes front suspension and a 24-speed gear system, ideal for both city commuting and trail riding.",871190
"Featuring a classic green design, this bike offers a comfortable ride with its cushioned seat and smooth-rolling tires.""",871190
"""This rugged orange mountain bike includes disc brakes and a 27-speed gear system, perfect for tackling rough terrain.""",871190
"With a sleek silver frame and 16-speed gear system, this road bike offers a balance of speed and control on long rides.""",871190
"""The stylish purple cruiser bike features wide tires and a comfortable saddle, designed for relaxed rides around the neighborhood.""",871190
"""This modern black e-bike includes a powerful motor and a 10-speed gear system, perfect for easy commutes and longer journeys.""",871190
"With a bright yellow frame and front suspension, this bike is ideal for both urban commuting and light trail riding.""",871190
"The classic white BMX bike features a durable steel frame and 18-speed gear system, perfect for tricks and stunts.""",871190
"This elegant teal road bike includes a lightweight aluminum frame and 20-speed gear system, designed for competitive racing.",871190
"""With a rugged brown frame and 24-speed gear system, this mountain bike is perfect for tackling steep trails and rocky paths.""",871190
"The sleek black folding bike features a compact design and 6-speed gear system, ideal for city commuting and easy storage.",871190
"This vibrant red hybrid bike includes front and rear suspension, offering a smooth ride on various terrains.""",871190
"""With a stylish silver design and 21-speed gear system, this bike is perfect for both urban commuting and recreational rides.""",871190
"The classic green cruiser bike features a retro design with a cushioned seat and wide tires for a comfortable ride.""",871190
"""This modern blue mountain bike includes a full suspension system and 27-speed gear setup, ideal for rough trails and off-road adventures.""",871190
"With a sleek black design, this road bike offers aerodynamic features and a 14-speed gear system for efficient speed and performance.""",871190
"The stylish orange BMX bike includes a durable frame and 20-speed gear system, perfect for performing tricks and stunts.""",871190
"""This versatile purple hybrid bike features a lightweight frame and 18-speed gear system, ideal for both city commutes and light trails.""",871190
"""With a bright yellow frame and front suspension, this mountain bike offers a comfortable ride over rough terrain and trails.",871190
"""The sleek white e-bike includes an integrated motor and 9-speed gear system, perfect for effortless commuting and longer rides.",871190
"This elegant green road bike features a lightweight carbon frame and 22-speed gear system, designed for speed and agility on the road.""",871190
"With a stylish blue design and 26-speed gear system, this mountain bike is ideal for tackling various terrains and trails",871190
The classic red cruiser bike features a retro design with a comfortable seat and wide tires for leisurely rides around town,871190
"This rugged black mountain bike includes a full suspension system and 24-speed gear setup, perfect for challenging trails and rugged terrain",871190
"With a sleek silver design and 20-speed gear system, this bike is perfect for fast-paced road cycling and long-distance rides.",871190
"""The modern green folding bike includes a compact frame and 7-speed gear system, ideal for easy storage and urban commuting.""",871190
"""This stylish purple e-bike features a powerful motor and 12-speed gear system, perfect for effortless rides and commuting",871190
"With a bright yellow frame and front suspension, this bike offers a smooth ride on various terrains, including city streets and light trails.",871190
"The classic blue road bike includes a lightweight aluminum frame and 18-speed gear system, designed for speed and performance.""",871190
"This elegant black cruiser bike features wide tires and a cushioned seat, ideal for relaxed rides and leisurely outings.""",871190
"With a rugged brown design and 27-speed gear system, this mountain bike is perfect for tackling rough trails and uneven surfaces.""",871190
"The sleek white BMX bike includes a durable frame and 16-speed gear system, perfect for performing tricks and enjoying a fun ride.""",871190
"This modern red hybrid bike features a front suspension system and 21-speed gear setup, ideal for both city commutes and recreational rides.""",871190
"With a stylish silver frame and 24-speed gear system, this bike is perfect for both urban commuting and long-distance rides",871190
"The classic green e-bike includes an integrated motor and 10-speed gear system, designed for smooth and efficient commutin",871190
"This sleek blue mountain bike features a full suspension system and 27-speed gear setup, perfect for off-road adventures and trail riding.""",871190
"""With a vibrant orange frame and front suspension, this bike offers a comfortable ride over various terrains and city streets.""",871190
"The modern black road bike includes a lightweight carbon frame and 20-speed gear system, designed for speed and agility.""",871190
"""This stylish green BMX bike features a durable frame and 18-speed gear system, perfect for tricks, stunts, and street riding.""",871190
"With a classic white design and front suspension, this hybrid bike offers a smooth ride for both city commuting and light trails.""",871190
"""The elegant silver cruiser bike includes a cushioned seat and wide tires, ideal for a comfortable and relaxed ride around town.""",871190
"""This rugged blue mountain bike features a 24-speed gear system and full suspension, perfect for challenging trails and rough terrain.""",871190
"With a sleek black folding bike and 7-speed gear system, this bike is perfect for easy storage and urban commuting.""",871190
"""The modern red e-bike includes a powerful motor and 12-speed gear system, designed for effortless commutes and longer rides.""",871190
"This stylish purple road bike features a lightweight aluminum frame and 18-speed gear system, ideal for fast-paced rides and fitness training.""",871190
"With a classic green design and 26-speed gear system, this mountain bike is perfect for tackling various terrains and trails.""",871190
"The elegant white cruiser bike features wide tires and a comfortable seat, perfect for leisurely rides and relaxed outings.""",871190
"This sleek black hybrid bike includes front and rear suspension, offering a smooth ride on both city streets and light trails",871190
"With a vibrant blue frame and 21-speed gear system, this mountain bike is perfect for adventurous riders and off-road trails.",871190
"The modern silver road bike features a lightweight carbon frame and 20-speed gear system, ideal for competitive racing and speed",871190
"This classic red BMX bike includes a durable steel frame and 18-speed gear system, perfect for tricks and stunts.""",871190
"""With a stylish green design and 24-speed gear system, this hybrid bike offers versatility for both city commuting and light trails.",871190
"The elegant black e-bike features a powerful motor and 10-speed gear system, designed for efficient and effortless commuting.""",871190
"This rugged orange mountain bike includes front suspension and 27-speed gear system, ideal for challenging trails and rough terrain.""",871190
"With a sleek blue frame and 18-speed gear system, this road bike is perfect for fast-paced rides and long-distance cycling.""",871190
"""The modern silver cruiser bike features wide tires and a cushioned seat, ideal for a comfortable and stylish ride around town.""",871190
"""This classic white hybrid bike includes front and rear suspension, offering a smooth ride for city commutes and light trail rides.""",871190
"""With a stylish black design and a 21-speed gear system, this mountain bike is perfect for both recreational and adventurous riding.""",871190
"The elegant green road bike features a lightweight aluminum frame and 20-speed gear system, designed for speed and performance.""",871190
"""This sleek red e-bike includes a powerful motor and 12-speed gear system, ideal for effortless commutes and longer journeys.""",871190
"With a vibrant blue design and 26-speed gear system, this mountain bike is perfect for tackling rough trails and diverse terrains.""",871190
"""The modern silver BMX bike features a durable frame and 18-speed gear system, perfect for tricks and urban riding.""",871190
"This stylish black road bike includes a lightweight carbon frame and 18-speed gear system, ideal for competitive racing and fitness.""",871190
"""With a classic green cruiser bike and wide tires, this model offers a comfortable ride for leisurely outings and neighborhood rides.""",871190
"The elegant white hybrid bike features a front suspension system and 21-speed gear setup, perfect for both city commutes and trail riding.""",871190
"""This rugged orange mountain bike includes a 24-speed gear system and full suspension, designed for challenging off-road terrain",871190
"With a sleek black design and a 7-speed gear system, this folding bike is perfect for easy storage and urban commuting.""",871190
"The modern red road bike includes a lightweight aluminum frame and 22-speed gear system, ideal for speed and performance",871190
"This stylish green BMX bike features a durable frame and 18-speed gear system, perfect for street riding and tricks.""",871190
"With a classic white design and 26-speed gear system, this hybrid bike is perfect for versatile use on city streets and light trails.""",871190
"The elegant blue cruiser bike features wide tires and a cushioned seat, ideal for a comfortable and relaxed ride around town",871190
"This sleek black mountain bike includes a 27-speed gear system and front suspension, perfect for off-road adventures and rugged terrain.",871190
"With a stylish silver e-bike and a 10-speed gear system, this model offers effortless commuting and extended battery life",871190
"The modern red road bike features a lightweight carbon frame and 18-speed gear system, designed for speed and endurance",871190
"This classic green cruiser bike includes a comfortable seat and wide tires, perfect for leisurely rides and casual outings",871190
"With a vibrant blue design and 24-speed gear system, this mountain bike is ideal for challenging trails and off-road adventures",871190
"""The elegant white BMX bike features a durable frame and 16-speed gear system, perfect for tricks and stunts",871190
"This stylish black hybrid bike includes front and rear suspension, offering a smooth ride for both city commuting and light trails.",871190
"With a classic silver design and 26-speed gear system, this mountain bike is perfect for adventurous rides and rough terrain.""",871190
"The modern red cruiser bike features wide tires and a cushioned seat, ideal for comfortable and stylish rides around town.""",871190
"This sleek green e-bike includes a powerful motor and 12-speed gear system, designed for efficient and effortless commuting.""",871190
"With a vibrant blue frame and 21-speed gear system, this mountain bike is perfect for both recreational and challenging rides.""",871190
"""The elegant black road bike features a lightweight aluminum frame and 18-speed gear system, perfect for competitive racing.""",871190
"This stylish white BMX bike includes a durable frame and 20-speed gear system, ideal for tricks and stunts.""",871190
"With a classic orange design and front suspension, this mountain bike offers a smooth ride over various terrains and trails.""",871190
"The modern silver hybrid bike features a 24-speed gear system and front suspension, perfect for both city commuting and light trails.",871190
"This sleek black cruiser bike includes wide tires and a comfortable seat, ideal for relaxed and leisurely rides around town.",871190
"""With a vibrant green design and 18-speed gear system, this road bike is perfect for speed and long-distance ride",871190
"The classic red hybrid bike includes front suspension and 21-speed gear system, ideal for both urban commuting and off-road trails",871190
"This stylish blue e-bike features a powerful motor and 10-speed gear system, designed for easy commuting and extended rides.",871190
"With a modern silver design and 26-speed gear system, this mountain bike is perfect for tackling challenging trails and rugged terrain",871190
"The elegant black road bike features a lightweight carbon frame and 20-speed gear system, perfect for speed and agility.",871190
"This classic green cruiser bike includes a comfortable seat and wide tires, ideal for leisurely rides and relaxed outings.",871190
"With a vibrant orange design and 24-speed gear system, this mountain bike offers versatility for both recreational and challenging rides",871190
"The sleek white folding bike includes a 7-speed gear system and compact design, perfect for easy storage and city commuting.""",871190
"This modern red BMX bike features a durable frame and 18-speed gear system, ideal for tricks, stunts, and street riding.",871190
"""With a stylish black hybrid bike and front suspension, this model is perfect for both city commuting and light off-road trails",871190
"The elegant blue road bike features a lightweight aluminum frame and 22-speed gear system, designed for speed and endurance",871190
"This high-performance red mountain bike features a robust steel frame and 30-speed gear system, perfect for tackling any terrain.""",871190
"""With a sleek black road bike design, this model includes an aerodynamic frame and 22-speed gear system for speed and precision.""",871190
"""The stylish blue hybrid bike features front suspension and a 27-speed gear system, ideal for city commuting and trail riding.""",871190
"""This classic green cruiser bike includes a comfortable saddle and wide tires, perfect for leisurely rides and relaxed outings.""",871190
"""With a modern orange design, this bike features a lightweight aluminum frame and a 21-speed gear system for versatility and speed.""",871190
"""The elegant white folding bike includes a 6-speed gear system and compact frame, making it perfect for easy storage and urban commuting.""",871190
"""This versatile purple hybrid bike features a front suspension system and 18-speed gear setup, suitable for both city streets and light trails.""",871190
"""With a rugged black mountain bike design, this model includes a full suspension and 27-speed gear system for off-road adventures.""",871190
"The sleek silver road bike features a carbon frame and 20-speed gear system, designed for high-speed rides and competitive racing.",871190
"This vibrant yellow BMX bike includes a durable frame and 16-speed gear system, ideal for tricks, stunts, and urban riding.""",871190
"With a stylish teal design, this bike includes a 24-speed gear system and front suspension, perfect for a smooth ride on various terrains.""",871190
"The modern red e-bike features an integrated motor and 12-speed gear system, designed for effortless commuting and longer journeys.",871190
"This sleek black mountain bike includes a full suspension and 18-speed gear system, making it ideal for challenging trails and rough terrain.""",871190
"With a classic white design and 21-speed gear system, this hybrid bike offers versatility for both city commuting and recreational rides.",871190
"""The elegant blue road bike features a lightweight aluminum frame and 18-speed gear system, perfect for long-distance rides and speed.""",871190
"This stylish green cruiser bike includes wide tires and a cushioned seat, ideal for comfortable and leisurely rides around town.""",871190
"With a rugged orange design, this mountain bike includes a 27-speed gear system and front suspension for off-road adventures.",871190
"The modern black folding bike features a compact frame and 7-speed gear system, making it perfect for easy storage and urban commuting",871190
"This vibrant purple e-bike includes a powerful motor and 10-speed gear system, ideal for effortless rides and efficient commuting.",871190
"""With a classic silver design and front suspension, this bike includes a 24-speed gear system, suitable for both city commutes and trails.",871190
"""The stylish red BMX bike features a durable frame and 18-speed gear system, perfect for performing tricks and street riding.""",871190
"This sleek blue hybrid bike includes a 21-speed gear system and front suspension, designed for both urban commuting and light trails.""",871190
"""With a modern black road bike and 20-speed gear system, this model offers speed and precision for competitive cycling.""",871190
"The elegant green mountain bike features a full suspension system and 27-speed gear setup, ideal for tackling various terrains.""",871190
"""This stylish white cruiser bike includes a comfortable saddle and wide tires, designed for relaxed and leisurely rides around town.""",871190
"With a rugged orange frame and 18-speed gear system, this hybrid bike is perfect for both city commuting and trail riding.""",871190
"""The modern teal e-bike features a powerful motor and 12-speed gear system, designed for easy commutes and extended rides.""",871190
"This classic black road bike includes a lightweight carbon frame and 22-speed gear system, ideal for high-speed cycling and endurance.""",871190
"With a stylish red mountain bike and 24-speed gear system, this model is perfect for off-road adventures and rugged terrain.""",871190
"The sleek silver hybrid bike features front suspension and a 21-speed gear system, ideal for versatile use and smooth rides.""",871190
"This elegant blue folding bike includes a compact design and 7-speed gear system, perfect for urban commuting and easy storage.""",871190
"""With a classic green design and a 27-speed gear system, this bike is ideal for both trail riding and city commuting.""",871190
"The modern black e-bike features a powerful motor and 10-speed gear system, designed for effortless commuting and long-distance rides.",871190
"This vibrant purple mountain bike includes a full suspension and 18-speed gear system, perfect for off-road challenges and rugged trails.",871190
"With a stylish white road bike and 20-speed gear system, this model is designed for speed and precision on long rides",871190
"The sleek blue cruiser bike features wide tires and a cushioned seat, perfect for relaxed rides and leisurely outings.",871190
"This modern red hybrid bike includes a front suspension system and 21-speed gear setup, ideal for both city streets and light trails.""",871190
"With a classic silver design and 24-speed gear system, this bike is perfect for versatile use and smooth riding on various terrains.""",871190
"The elegant black mountain bike features a full suspension and 27-speed gear system, ideal for tackling rugged trails and rough terrain",871190
"""This stylish green e-bike includes a powerful motor and 12-speed gear system, designed for easy commuting and extended journeys.",871190
"With a classic white road bike and 18-speed gear system, this model offers speed and efficiency for competitive cycling.""",871190
"""The modern teal cruiser bike features wide tires and a cushioned seat, perfect for comfortable and relaxed rides around town.""",871190
"This vibrant blue folding bike includes a compact design and 6-speed gear system, making it ideal for city commuting and easy storage.""",871190
"""With a sleek black design and 24-speed gear system, this hybrid bike is perfect for both city commuting and trail riding.""",871190
"""The stylish red mountain bike features a full suspension system and 27-speed gear setup, designed for challenging off-road terrain.""",871190
"This modern silver e-bike includes a powerful motor and 10-speed gear system, perfect for effortless commuting and long rides.""",871190
"""With a classic green road bike design and 22-speed gear system, this model offers speed and performance for competitive cyclists.""",871190
"""The elegant blue hybrid bike includes a front suspension system and 21-speed gear setup, ideal for city streets and light trails",871190
