product description,Hscode
"This stylish blue phone boasts a 6.7-inch AMOLED display and 5000mAh battery, ideal for high-performance tasks and extended use",851712
"The compact white mobile features a 6-inch screen and advanced dual-camera system, perfect for capturing everyday moments",851712
"This sleek gray phone includes a 5.9-inch display and 4000mAh battery, designed for users who need a balance of style and function",851712
"The modern red mobile offers a 6.4-inch screen and fast-charging 5000mAh battery, ideal for gamers and heavy users",851712
"This stylish green phone features a 6.7-inch display and AI-powered camera, perfect for capturing vibrant photos and videos",851712
"The elegant black mobile includes a 6.5-inch AMOLED screen and long-lasting 4500mAh battery, ideal for multimedia and productivity",851712
"This compact blue phone features a 5.8-inch display and fast-charging 3000mAh battery, perfect for users on the go",851712
"The rugged gray mobile offers a 6.6-inch screen and 5000mAh battery, designed for durability and high performance",851712
"This sleek white phone includes a 6.3-inch AMOLED display and AI-enhanced camera, perfect for capturing detailed and vibrant images",851712
"The modern red mobile features a 6.4-inch screen and 4000mAh battery, ideal for everyday use and multimedia",851712
"This stylish green phone boasts a 7-inch display and long-lasting battery, perfect for gaming and video streaming",851712
"The elegant blue mobile includes a 6.5-inch AMOLED screen and fast-charging capabilities, designed for high performance",851712
"This compact black phone features a 5.9-inch display and 3000mAh battery, ideal for users who need a reliable and portable device",851712
"The rugged white mobile offers a 6.6-inch display and 5000mAh battery, perfect for users who demand durability and extended battery life",851712
"This stylish gray phone includes a 6.4-inch screen and advanced camera system, perfect for capturing high-quality images",851712
"The sleek blue mobile features a 6.7-inch AMOLED screen and 4500mAh battery, designed for gaming and multimedia enthusiasts",851712
"This modern red phone offers a 6.3-inch display and AI-enhanced camera, perfect for capturing detailed and vibrant photos",851712
"The elegant green mobile features a 7-inch screen and fast-charging 5000mAh battery, ideal for heavy users and gamers",851712
"This compact black phone includes a 5.8-inch display and long-lasting battery, making it perfect for users on the go",851712
"The stylish white mobile offers a 6.5-inch AMOLED display and advanced features, ideal for capturing stunning visuals",851712
"This sleek gray phone features a 6.4-inch screen and fast-charging capabilities, perfect for busy professionals",851712
"The modern blue mobile includes a 6.7-inch display and powerful battery, ideal for high-performance tasks and extended use",851712
"This elegant red phone boasts a 6.5-inch AMOLED screen and 4000mAh battery, designed for multimedia and gaming",851712
"The stylish green mobile features a 6.2-inch display and AI-powered camera, perfect for capturing vivid and detailed photos",851712
"This compact blue phone includes a 5.9-inch display and fast-charging 3000mAh battery, ideal for users who need efficiency and portability",851712
"The sleek white mobile offers a 6.6-inch screen and long-lasting battery, perfect for multimedia consumption and gaming",851712
"This modern gray phone features a 6.5-inch AMOLED display and advanced camera system, designed for high-quality photography",851712
"The stylish black mobile includes a 6.4-inch screen and 5000mAh battery, ideal for users who need durability and high performance",851712
"This elegant blue phone offers a 6.7-inch AMOLED display and AI-enhanced camera, perfect for capturing dynamic and vibrant images",851712
"The compact green mobile features a 5.8-inch display and fast-charging 4000mAh battery, ideal for on-the-go use",851712
"This sleek red phone includes a 6.6-inch screen and 4500mAh battery, making it perfect for high-performance tasks and entertainment",851712
"The modern white mobile features a 6.3-inch AMOLED display and advanced security features, ideal for tech-savvy users",851712
"This stylish gray phone boasts a 6.5-inch screen and AI-powered camera, perfect for capturing high-resolution photos and videos",851712
"The sleek green mobile includes a 7-inch display and 5000mAh battery, designed for gaming and multimedia enthusiasts",851712
"This elegant blue phone features a 6.4-inch AMOLED screen and fast-charging capabilities, ideal for busy professionals",851712
"The compact black mobile offers a 5.8-inch display and long-lasting battery, making it perfect for everyday use and portability",851712
"This modern red phone includes a 6.5-inch screen and advanced dual-camera system, perfect for capturing everyday moments",851712
"The sleek white mobile features a 6.3-inch AMOLED display and 4000mAh battery, designed for a blend of style and performance",851712
"This stylish blue phone offers a 7-inch display and AI-enhanced camera, perfect for capturing detailed and vibrant photos",851712
"The elegant gray mobile features a 6.4-inch AMOLED screen and fast-charging capabilities, ideal for multimedia and gaming",851712
"This compact green phone includes a 5.9-inch display and long-lasting 3000mAh battery, perfect for users on the go",851712
"The modern black mobile offers a 6.7-inch screen and powerful battery, designed for high-performance and extended use",851712
"This sleek red phone features a 6.3-inch AMOLED display and advanced security features, ideal for tech enthusiasts",851712
"The stylish white mobile includes a 6.5-inch screen and 5000mAh battery, perfect for gaming and multimedia consumption",851712
"This elegant blue phone offers a 7-inch AMOLED display and AI-powered camera, making it ideal for capturing vibrant images",851712
"The compact gray mobile features a 6.4-inch screen and long-lasting 4000mAh battery, designed for users who need efficiency and style",851712
"This sleek black mobile features a 6.8-inch Super AMOLED display and 5000mAh battery, perfect for extended gaming and media use",851712
"With a 5.7-inch screen and 4000mAh battery, this white phone offers excellent performance and portability for everyday tasks",851712
"The red mobile includes a 6.6-inch display and advanced AI camera, ideal for capturing high-resolution photos and videos",851712
"This green phone features a 6.3-inch AMOLED screen and 4500mAh battery, designed for high performance and long-lasting use",851712
"Enjoy seamless multitasking with this blue mobile's 7-inch screen and powerful 5000mAh battery, perfect for productivity and entertainment",851712
"The stylish gray phone boasts a 6.5-inch display and AI-enhanced camera, making it perfect for capturing vibrant and detailed images",851712
"This compact red mobile offers a 5.8-inch screen and 3000mAh battery, ideal for users who need a reliable and portable device",851712
"The modern white phone includes a 6.4-inch AMOLED display and fast-charging capabilities, perfect for busy professionals and multimedia use",851712
"With a 6.7-inch screen and 4000mAh battery, this blue mobile is designed for high-performance tasks and gaming enthusiasts",851712
"This elegant green phone features a 5.9-inch AMOLED display and advanced dual-camera system, perfect for capturing everyday moments",851712
"The sleek black mobile offers a 6.2-inch display and 5000mAh battery, ideal for users who need a powerful and long-lasting device",851712
"This stylish yellow phone includes a 6.5-inch screen and fast-charging 4000mAh battery, perfect for streaming and multimedia consumption",851712
"The compact blue mobile features a 5.8-inch display and 3000mAh battery, ideal for users on the go and quick access",851712
"With a 6.6-inch AMOLED screen and 4500mAh battery, this green phone offers excellent performance and durability for heavy use",851712
"The elegant white mobile includes a 6.3-inch display and AI-enhanced camera, perfect for capturing detailed and vibrant photos",851712
"This sleek gray phone features a 7-inch screen and long-lasting 5000mAh battery, ideal for extended use and multimedia entertainment",851712
"The stylish black mobile boasts a 6.4-inch AMOLED display and fast-charging capabilities, perfect for gamers and power users",851712
"This vibrant red phone features a 6.5-inch screen and advanced dual-camera system, ideal for capturing stunning photos and videos",851712
"With a 5.9-inch display and 4000mAh battery, this green mobile offers a balance of performance and portability for everyday tasks",851712
"The sleek blue phone includes a 6.7-inch AMOLED screen and 5000mAh battery, perfect for high-performance use and multimedia enjoyment",851712
"This stylish gray mobile features a 6.2-inch display and advanced AI camera, making it ideal for capturing high-resolution images",851712
"The compact white phone boasts a 5.8-inch screen and 3000mAh battery, perfect for users who prefer a smaller, efficient device",851712
"With a 6.6-inch AMOLED display and 4500mAh battery, this red phone offers excellent performance and extended battery life for heavy users",851712
"The elegant blue mobile includes a 6.4-inch screen and fast-charging 5000mAh battery, ideal for gaming and multimedia activities",851712
"This sleek green phone features a 6.3-inch display and AI-enhanced camera, perfect for capturing vibrant and detailed photos",851712
"The modern gray mobile boasts a 6.5-inch AMOLED screen and 4000mAh battery, designed for everyday use and high performance",851712
"This stylish white phone includes a 6.2-inch display and fast-charging 3000mAh battery, perfect for quick access and daily tasks",851712
"The compact black mobile features a 5.7-inch screen and long-lasting 4000mAh battery, ideal for users on the move",851712
"With a 6.6-inch AMOLED display and powerful 5000mAh battery, this red phone is perfect for streaming, gaming, and productivity",851712
"The sleek blue mobile offers a 6.3-inch screen and advanced dual-camera system, making it ideal for capturing high-quality photos and videos",851712
"This elegant green phone features a 6.7-inch display and 4500mAh battery, perfect for multimedia use and extended battery life",851712
"The modern white mobile includes a 5.9-inch AMOLED screen and fast-charging 4000mAh battery, ideal for everyday tasks and quick access",851712
"With a 6.5-inch display and 3000mAh battery, this gray phone offers a compact yet powerful solution for daily use",851712
"The stylish black mobile boasts a 6.4-inch AMOLED display and 5000mAh battery, perfect for high-performance tasks and gaming",851712
"This sleek red phone features a 6.6-inch screen and AI-enhanced camera, ideal for capturing stunning photos and videos",851712
"The elegant blue mobile includes a 7-inch AMOLED display and fast-charging 4500mAh battery, designed for heavy use and gaming",851712
"This compact green phone features a 5.8-inch screen and long-lasting 4000mAh battery, perfect for users who need a reliable device",851712
"With a 6.3-inch display and advanced dual-camera system, this white mobile is ideal for capturing vibrant and detailed photos",851712
"The stylish gray phone includes a 6.5-inch AMOLED screen and 5000mAh battery, perfect for extended use and multimedia entertainment",851712
"This sleek blue mobile offers a 6.2-inch display and fast-charging 3000mAh battery, ideal for quick access and daily tasks",851712
"The modern red phone features a 6.4-inch screen and powerful 4500mAh battery, designed for high performance and long-lasting use",851712
"This elegant green mobile includes a 6.6-inch AMOLED display and advanced AI camera, perfect for capturing high-resolution images",851712
"The compact black phone features a 5.9-inch screen and 4000mAh battery, ideal for users who need a reliable and portable device",851712
"With a 7-inch AMOLED display and 5000mAh battery, this blue phone is designed for gaming and multimedia enthusiasts",851712
"This stylish white mobile includes a 6.3-inch screen and advanced camera system, perfect for everyday photography and media consumption",851712
"The sleek gray phone features a 6.4-inch AMOLED display and 4500mAh battery, ideal for heavy use and long-lasting performance",851712
"This modern red phone offers a 5.8-inch screen and AI-enhanced camera, perfect for capturing detailed and vibrant photos",851712
"The elegant blue mobile includes a 6.5-inch AMOLED display and 5000mAh battery, designed for multimedia use and gaming",851712
"With a 6.7-inch screen and 4000mAh battery, this green phone is ideal for high-performance tasks and extended use",851712
"The compact white phone features a 5.9-inch display and long-lasting 3000mAh battery, perfect for users on the go",851712
"This sleek black mobile offers a 6.2-inch AMOLED display and 5000mAh battery, ideal for productivity and extended gaming sessions",851712
"The stylish red phone includes a 6.4-inch display and fast-charging 4500mAh battery, perfect for gaming and multimedia enthusiasts",851712
"This elegant green mobile features a 6.6-inch screen and AI-enhanced camera, ideal for capturing high-resolution photos and videos",851712
"With a 7-inch AMOLED display and 4000mAh battery, this blue phone is perfect for streaming and gaming",851712
"The modern white mobile includes a 6.5-inch screen and fast-charging 3000mAh battery, designed for convenience and performance",851712
"This stylish gray phone offers a 5.8-inch AMOLED display and long-lasting 4000mAh battery, ideal for everyday use",851712
"The sleek black mobile features a 6.3-inch display and powerful 5000mAh battery, perfect for high-performance tasks and entertainment",851712
"With a 6.4-inch AMOLED screen and 4500mAh battery, this red phone is designed for extended use and gaming",851712
"The compact blue mobile includes a 5.9-inch screen and fast-charging 3000mAh battery, ideal for users who need portability and efficiency",851712
"This elegant white phone features a 6.7-inch AMOLED display and advanced dual-camera system, perfect for capturing vivid photos and videos",851712
"The modern green mobile offers a 6.5-inch screen and 4000mAh battery, designed for everyday tasks and high performance",851712
"With a 6.3-inch AMOLED display and fast-charging 5000mAh battery, this gray phone is perfect for multimedia use and extended battery life",851712
"This stylish black phone features a 7-inch screen and advanced camera system, ideal for high-resolution photography and gaming.",851712
"The sleek red mobile includes a 6.4-inch AMOLED display and 3000mAh battery, perfect for everyday tasks and quick access",851712
"This elegant blue phone offers a 5.8-inch display and long-lasting 4500mAh battery, designed for portability and high performance",851712
"With a 6.6-inch screen and AI-enhanced camera, this white mobile is ideal for capturing vibrant and detailed images",851712
"The modern gray mobile features a 6.5-inch AMOLED display and 5000mAh battery, perfect for gaming and multimedia entertainment",851712
"This stylish green phone includes a 7-inch screen and fast-charging 4000mAh battery, ideal for heavy use and productivity",851712
"The sleek blue mobile offers a 6.3-inch AMOLED display and powerful 3000mAh battery, perfect for everyday use and efficiency.",851712
"This compact red phone features a 5.7-inch display and long-lasting 4500mAh battery, designed for reliability and extended use",851712
"With a 6.4-inch AMOLED screen and 5000mAh battery, this white mobile is perfect for gaming and multimedia tasks",851712
"The stylish gray phone features a 6.5-inch display and advanced AI camera, making it ideal for capturing high-quality photos and videos",851712
"This elegant blue mobile includes a 6.7-inch AMOLED screen and fast-charging 4000mAh battery, perfect for gaming and productivity",851712
"The modern red phone offers a 5.9-inch display and long-lasting 3000mAh battery, ideal for users on the go",851712
"With a 6.6-inch AMOLED display and advanced camera system, this green phone is designed for high-performance photography",851712
"The sleek black mobile features a 6.4-inch screen and fast-charging 4500mAh battery, perfect for extended use and gaming",851712
"This stylish white phone includes a 6.3-inch AMOLED display and 5000mAh battery, ideal for multimedia consumption and productivity",851712
"The modern gray mobile offers a 7-inch screen and advanced AI camera, designed for capturing stunning photos and videos",851712
"This elegant blue phone features a 6.5-inch AMOLED display and fast-charging 4000mAh battery, perfect for high-performance tasks",851712
"With a 6.2-inch display and 3000mAh battery, this red mobile is perfect for users who need efficiency and portability",851712
"The sleek green phone includes a 6.7-inch AMOLED screen and advanced camera system, designed for gaming and multimedia use",851712
"This stylish black mobile features a 5.8-inch display and 4500mAh battery, perfect for extended use and high performance",851712
"The modern white phone offers a 6.4-inch AMOLED screen and fast-charging 5000mAh battery, ideal for busy professionals",851712
"This sleek black smartwatch features a 1.4-inch display and a heart rate monitor, perfect for fitness enthusiasts",910211
"With a classic silver design and a large 1.3-inch touchscreen, this watch offers seamless integration with your smartphone",910211
"The elegant gold watch includes a 1.2-inch display and advanced fitness tracking features, ideal for health-conscious users",910211
"This rugged gray sports watch offers a 1.5-inch screen and GPS functionality, designed for outdoor adventure",910211
"Featuring a vibrant blue band and a 1.4-inch display, this smartwatch includes a built-in sleep tracker and notification alerts",910211
"The stylish rose gold watch boasts a 1.3-inch touchscreen and a sleek design, perfect for both casual and formal occasions",910211
"This modern black watch offers a 1.5-inch display and heart rate monitoring, ideal for tracking workouts and daily activities",910211
"With a silver metal band and 1.2-inch screen, this watch features step counting and sleep analysis, designed for everyday use",910211
"The classic white watch includes a 1.4-inch AMOLED display and GPS tracking, making it perfect for both fitness and navigation",910211
"This fashionable green watch features a 1.3-inch screen and water resistance, ideal for active lifestyles and outdoor activities",910211
"The sleek navy blue watch offers a 1.2-inch display and advanced health monitoring features, perfect for tech-savvy users",910211
"Featuring a durable black band and a 1.4-inch display, this watch includes an activity tracker and customizable watch faces",910211
"This elegant silver watch boasts a 1.5-inch screen and built-in heart rate monitor, designed for both style and functionality",910211
"With a classic leather band and 1.3-inch touchscreen, this watch offers notifications and fitness tracking, perfect for everyday wear",910211
"The modern rose gold watch includes a 1.4-inch display and sleep monitoring features, ideal for keeping track of health and rest",910211
"This sporty gray watch offers a 1.5-inch display and water resistance, designed for athletes and outdoor enthusiasts",910211
"Featuring a vibrant red band and a 1.2-inch screen, this smartwatch includes GPS tracking and fitness monitoring features",910211
"The stylish black watch includes a 1.3-inch AMOLED display and customizable settings, perfect for personalizing your experience",910211
"With a classic silver design and a 1.4-inch touchscreen, this watch offers seamless connectivity with your smartphone and fitness tracking",910211
"This elegant white watch features a 1.3-inch display and advanced health tracking, making it perfect for both casual and active users",910211
"The modern blue watch offers a 1.5-inch screen and heart rate monitoring, designed for those who want both style and performance",910211
"Featuring a sleek black band and a 1.4-inch AMOLED display, this smartwatch includes notifications and activity tracking features",910211
"This rugged gray watch boasts a 1.2-inch display and GPS functionality, perfect for hiking and outdoor adventures",910211
"With a stylish rose gold design and a 1.3-inch screen, this watch includes fitness tracking and customizable watch faces",910211
"The elegant silver watch features a 1.5-inch display and heart rate monitoring, ideal for maintaining a healthy lifestyle",910211
"This sporty green watch includes a 1.4-inch AMOLED screen and built-in GPS, designed for athletes and fitness enthusiasts",910211
"Featuring a modern black band and a 1.3-inch touchscreen, this smartwatch offers sleep tracking and smartphone notifications",910211
"The classic white watch boasts a 1.5-inch display and advanced health features, perfect for daily use and fitness tracking",910211
"With a sleek navy blue design and a 1.4-inch display, this watch includes water resistance and activity monitoring capabilities",910211
"This elegant rose gold watch offers a 1.2-inch screen and customizable watch faces, ideal for both fashion and function",910211
"The stylish gray watch includes a 1.3-inch AMOLED display and built-in heart rate monitoring, perfect for fitness tracking",910211
"Featuring a vibrant black band and a 1.4-inch screen, this smartwatch includes GPS tracking and activity monitoring features",910211
"This rugged white watch offers a 1.5-inch display and advanced fitness tracking, designed for durability and high performance",910211
"With a classic silver design and a 1.3-inch touchscreen, this watch includes notifications and sleep tracking capabilities",910211
"The modern blue watch features a 1.4-inch AMOLED display and heart rate monitoring, perfect for active and tech-savvy users",910211
"This stylish green watch includes a 1.2-inch display and water resistance, designed for both casual and outdoor use",910211
"The elegant rose gold watch boasts a 1.3-inch screen and advanced health monitoring features, perfect for everyday wear",910211
"Featuring a sleek black band and a 1.5-inch AMOLED display, this watch includes customizable settings and fitness tracking",910211
"This modern gray watch offers a 1.4-inch display and built-in GPS, designed for both performance and style",910211
"With a stylish navy blue band and a 1.3-inch screen, this smartwatch includes sleep monitoring and activity tracking features",910211
"The elegant white watch features a 1.5-inch display and heart rate monitoring, perfect for health-conscious users and daily activities",910211
"This sleek silver watch includes a 1.4-inch AMOLED screen and advanced fitness tracking, ideal for both casual and athletic use",910211
"Featuring a modern black design and a 1.2-inch display, this watch offers GPS tracking and notifications for a balanced lifestyle",910211
"The stylish blue watch boasts a 1.5-inch screen and built-in heart rate monitor, perfect for high-performance activities and fitness",910211
"This elegant gray watch includes a 1.3-inch AMOLED display and water resistance, designed for everyday wear and active use",910211
"With a sleek rose gold band and a 1.4-inch display, this smartwatch includes fitness tracking and sleep monitoring features",910211
"The modern black watch features a 1.2-inch screen and advanced health monitoring, perfect for both style and functionality",910211
"This stylish white mobile offers a 1.5-inch AMOLED display and heart rate tracking, ideal for staying connected and healthy",910211
"Featuring a vibrant green band and a 1.3-inch display, this watch includes GPS tracking and customizable watch faces",910211
"The elegant blue watch boasts a 1.4-inch screen and advanced fitness tracking, perfect for those who prioritize health and technology",910211
"This sleek gray watch includes a 1.2-inch AMOLED display and water resistance, ideal for both casual and active use",910211
"With a stylish black design and a 1.5-inch display, this smartwatch offers heart rate monitoring and notifications for a balanced lifestyle",910211
"The modern silver watch features a 1.4-inch AMOLED screen and advanced health features, perfect for daily wear and fitness tracking",910211
"This elegant rose gold mobile includes a 1.3-inch display and built-in GPS, designed for those who enjoy style and functionality",910211
"Featuring a sleek navy blue band and a 1.2-inch screen, this watch offers sleep tracking and customizable watch faces",910211
"The stylish gray watch boasts a 1.5-inch AMOLED display and heart rate monitoring, perfect for both fitness and everyday use",910211
"This rugged black watch includes a 1.4-inch display and advanced GPS functionality, ideal for outdoor adventures and sports",910211
"With a classic white design and a 1.3-inch screen, this smartwatch offers fitness tracking and notifications for daily use",910211
"The modern green watch features a 1.5-inch AMOLED display and water resistance, perfect for active lifestyles and outdoor activities",910211
"This stylish blue watch includes a 1.2-inch screen and advanced health tracking, designed for both fashion and performance",910211
"Featuring a sleek rose gold band and a 1.4-inch display, this watch offers customizable settings and fitness tracking capabilities",910211
"The elegant gray watch boasts a 1.3-inch AMOLED display and built-in heart rate monitor, perfect for maintaining a healthy lifestyle",910211
"This stylish black watch includes a 1.5-inch screen and advanced GPS functionality, ideal for tech enthusiasts and athletes",910211
"With a modern silver design and a 1.4-inch display, this smartwatch offers fitness tracking and notifications for a balanced lifestyle",910211
"The elegant blue watch features a 1.3-inch AMOLED display and water resistance, designed for both casual and active wear",910211
